{
  "schema_version": 1,
  "content_revision": "core-dev.blake3.27818db710b7553520a162f6f8337dcd0419c459d20c6513a7e12c78fed24ebb",
  "dependencies": {
    "identity_manifest_blake3": "5aa3e234fceca348a1e008b7685898ff0149b4f46b37190bd011c9f80f1ac743",
    "world_records_blake3": "97b7188e26329b9430b7289d1e17d347c9b9472863b7db6bd48501fd3b773158",
    "world_assets_blake3": "32ce9fce6f1d49d5cd6cb570fa0590a5ee5644388c2620b67846320d4b2a3759",
    "world_localization_blake3": "895c38724abfdef4909751743d91b5cff90d7f073c553bc044601abff4763a26",
    "item_manifest_blake3": "27818db710b7553520a162f6f8337dcd0419c459d20c6513a7e12c78fed24ebb",
    "encounter_records_blake3": "2511ee54b27d3270f077da52919144fae72751a0aa700bf2b39cd3bba5f03554",
    "encounter_assets_blake3": "5c812601bc15317d96a7ea978b3f734570976fb37cfc724d3e24b168937d3bd8",
    "encounter_localization_blake3": "a84a300b67f95e886f4c1046a46dd25121c80f883836181fd8340d0a1ec2c6b1",
    "caldus_records_blake3": "0f67d81268e8a6adfae08338dcbf6577e07260547ef4d5083c3aad7b912a3e4c",
    "caldus_assets_blake3": "a1738b8117e4f39568c33b33d7bab4d0b9263c6e36fcc38036c5161b1e9136dc",
    "caldus_localization_blake3": "b3e5dd03a2cb6c534f9eaf017eb31f37dba81c8a4993e88371f7e75a4a9ea808",
    "oath_bargain_manifest_blake3": "91b1a3ab2157371d18dc2c8f48124b4f25c59cc6cf0be46b871274357b285533"
  },
  "copy_bindings": [
    {"content_id":"attack.environment.core_hazard","kind":"attack","localization_key":"attack.environment.core_hazard"},
    {"content_id":"attack.network.disconnect","kind":"attack","localization_key":"attack.network.disconnect"},
    {"content_id":"boss.caldus.bell_ring","kind":"pattern","localization_key":"boss.caldus.bell_ring"},
    {"content_id":"boss.caldus.charge_lane","kind":"pattern","localization_key":"boss.caldus.charge_lane"},
    {"content_id":"boss.caldus.charge_stop_ring","kind":"pattern","localization_key":"boss.caldus.charge_stop_ring"},
    {"content_id":"boss.caldus.shield_arc","kind":"pattern","localization_key":"boss.caldus.shield_arc"},
    {"content_id":"death.action.back","kind":"action","localization_key":"death.action.back"},
    {"content_id":"death.action.character_select","kind":"action","localization_key":"death.action.character_select"},
    {"content_id":"death.action.create_successor","kind":"action","localization_key":"death.action.create_successor"},
    {"content_id":"death.action.inspect_trace","kind":"action","localization_key":"death.action.inspect_trace"},
    {"content_id":"death.action.load_more","kind":"action","localization_key":"death.action.load_more"},
    {"content_id":"death.action.memorial","kind":"action","localization_key":"death.action.memorial"},
    {"content_id":"death.action.retry","kind":"action","localization_key":"death.action.retry"},
    {"content_id":"death.action.successor_unavailable","kind":"action","localization_key":"death.action.successor_unavailable"},
    {"content_id":"death.cause.damage_over_time","kind":"cause","localization_key":"death.cause.damage_over_time"},
    {"content_id":"death.cause.direct_hit","kind":"cause","localization_key":"death.cause.direct_hit"},
    {"content_id":"death.cause.disconnect","kind":"cause","localization_key":"death.cause.disconnect"},
    {"content_id":"death.cause.environment","kind":"cause","localization_key":"death.cause.environment"},
    {"content_id":"death.damage_type.physical","kind":"damage_type","localization_key":"death.damage_type.physical"},
    {"content_id":"death.damage_type.veil","kind":"damage_type","localization_key":"death.damage_type.veil"},
    {"content_id":"death.echo.available","kind":"echo_outcome","localization_key":"death.echo.available"},
    {"content_id":"death.echo.dormant","kind":"echo_outcome","localization_key":"death.echo.dormant"},
    {"content_id":"death.echo.not_eligible","kind":"echo_outcome","localization_key":"death.echo.not_eligible"},
    {"content_id":"death.error.content_mismatch","kind":"error","localization_key":"death.error.content_mismatch"},
    {"content_id":"death.error.corrupt_record","kind":"error","localization_key":"death.error.corrupt_record"},
    {"content_id":"death.error.death_not_found","kind":"error","localization_key":"death.error.death_not_found"},
    {"content_id":"death.error.death_not_owned","kind":"error","localization_key":"death.error.death_not_owned"},
    {"content_id":"death.error.feature_disabled","kind":"error","localization_key":"death.error.feature_disabled"},
    {"content_id":"death.error.page_out_of_range","kind":"error","localization_key":"death.error.page_out_of_range"},
    {"content_id":"death.error.service_unavailable","kind":"error","localization_key":"death.error.service_unavailable"},
    {"content_id":"death.error.title","kind":"error","localization_key":"death.error.title"},
    {"content_id":"death.error.unauthenticated","kind":"error","localization_key":"death.error.unauthenticated"},
    {"content_id":"death.field.attack","kind":"field","localization_key":"death.field.attack"},
    {"content_id":"death.field.cause","kind":"field","localization_key":"death.field.cause"},
    {"content_id":"death.field.class","kind":"field","localization_key":"death.field.class"},
    {"content_id":"death.field.damage","kind":"field","localization_key":"death.field.damage"},
    {"content_id":"death.field.damage_type","kind":"field","localization_key":"death.field.damage_type"},
    {"content_id":"death.field.final_deed","kind":"field","localization_key":"death.field.final_deed"},
    {"content_id":"death.field.killer","kind":"field","localization_key":"death.field.killer"},
    {"content_id":"death.field.level","kind":"field","localization_key":"death.field.level"},
    {"content_id":"death.field.lifetime","kind":"field","localization_key":"death.field.lifetime"},
    {"content_id":"death.field.network","kind":"field","localization_key":"death.field.network"},
    {"content_id":"death.field.recall","kind":"field","localization_key":"death.field.recall"},
    {"content_id":"death.field.source_position","kind":"field","localization_key":"death.field.source_position"},
    {"content_id":"death.format.damage","kind":"format","localization_key":"death.format.damage"},
    {"content_id":"death.format.lifetime","kind":"format","localization_key":"death.format.lifetime"},
    {"content_id":"death.format.position","kind":"format","localization_key":"death.format.position"},
    {"content_id":"death.format.quantity","kind":"format","localization_key":"death.format.quantity"},
    {"content_id":"death.format.timestamp_utc","kind":"format","localization_key":"death.format.timestamp_utc"},
    {"content_id":"death.memorial.empty","kind":"surface","localization_key":"death.memorial.empty"},
    {"content_id":"death.memorial.title","kind":"surface","localization_key":"death.memorial.title"},
    {"content_id":"death.network.connected","kind":"network_state","localization_key":"death.network.connected"},
    {"content_id":"death.network.degraded","kind":"network_state","localization_key":"death.network.degraded"},
    {"content_id":"death.network.link_lost","kind":"network_state","localization_key":"death.network.link_lost"},
    {"content_id":"death.network.reattached","kind":"network_state","localization_key":"death.network.reattached"},
    {"content_id":"death.recall.channeling","kind":"recall_state","localization_key":"death.recall.channeling"},
    {"content_id":"death.recall.completion_pending","kind":"recall_state","localization_key":"death.recall.completion_pending"},
    {"content_id":"death.recall.inactive","kind":"recall_state","localization_key":"death.recall.inactive"},
    {"content_id":"death.section.created","kind":"section","localization_key":"death.section.created"},
    {"content_id":"death.section.hero","kind":"section","localization_key":"death.section.hero"},
    {"content_id":"death.section.lost","kind":"section","localization_key":"death.section.lost"},
    {"content_id":"death.section.network","kind":"section","localization_key":"death.section.network"},
    {"content_id":"death.section.preserved","kind":"section","localization_key":"death.section.preserved"},
    {"content_id":"death.section.timeline","kind":"section","localization_key":"death.section.timeline"},
    {"content_id":"death.section.what_happened","kind":"section","localization_key":"death.section.what_happened"},
    {"content_id":"death.state.awaiting_commit","kind":"state","localization_key":"death.state.awaiting_commit"},
    {"content_id":"death.state.awaiting_commit_detail","kind":"state","localization_key":"death.state.awaiting_commit_detail"},
    {"content_id":"death.state.loading_memorial","kind":"state","localization_key":"death.state.loading_memorial"},
    {"content_id":"death.state.loading_summary","kind":"state","localization_key":"death.state.loading_summary"},
    {"content_id":"death.state.loading_trace","kind":"state","localization_key":"death.state.loading_trace"},
    {"content_id":"death.summary.eyebrow","kind":"surface","localization_key":"death.summary.eyebrow"},
    {"content_id":"death.summary.title","kind":"surface","localization_key":"death.summary.title"},
    {"content_id":"deed.core.sepulcher_knight_defeated","kind":"deed","localization_key":"deed.core.sepulcher_knight_defeated"},
    {"content_id":"deed.core.sir_caldus_defeated","kind":"deed","localization_key":"deed.core.sir_caldus_defeated"},
    {"content_id":"deed.none","kind":"deed","localization_key":"deed.none"},
    {"content_id":"environment.core.hazard","kind":"source","localization_key":"environment.core.hazard"},
    {"content_id":"hero.core.grave_arbalist","kind":"hero_label","localization_key":"hero.core.grave_arbalist"},
    {"content_id":"material.bell_brass","kind":"material","localization_key":"material.bell_brass"},
    {"content_id":"material.echo_ember","kind":"material","localization_key":"material.echo_ember"},